NAAM,TYPE_NAAM,GELD_START,LON,LAT,GEMEENTE
Grote Plaats en omgeving,Beschermd stads- of dorpsgezicht,1984/06/20,4.129,51.001,Lebbeke
Windmolenromp en molenaarshoeve,Beschermd stads- of dorpsgezicht,1999/04/01,2.927,50.995,Houthulst
Kerkplein en omgeving,Beschermd stads- of dorpsgezicht,1994/04/21,3.649,50.992,De Pinte
Scheldemeersen: fase 2,Beschermd cultuurhistorisch landschap,1997/03/10,3.677,50.961,De Pinte
Kasteel Scheldevelde met park en de Zeven Dreven,Beschermd cultuurhistorisch landschap,1974/10/15,3.671,50.996,De Pinte
Hoeven en Villa De Blijpoel met omgeving,Beschermd stads- of dorpsgezicht,1979/03/13,3.701,50.980,De Pinte
Gehucht Amelgem en omgeving,Beschermd cultuurhistorisch landschap,2003/06/13,4.303,50.927,Meise
Gehucht Rossem,Beschermd stads- of dorpsgezicht,2010/10/01,4.280,50.974,Meise
Hoeve Hof ten Steene: omgeving,Beschermd stads- of dorpsgezicht,2003/08/21,4.304,50.941,Meise
Hoeve Haeck met omgeving,Beschermd stads- of dorpsgezicht,1979/09/07,4.326,50.935,Meise
Pastorie Sint-Stephanusparochie: tuin,Beschermd cultuurhistorisch landschap,1976/10/14,4.306,50.938,Meise
Pastorie Onze-Lieve-Vrouw-Boodschapparochie met tuin,Beschermd stads- of dorpsgezicht,1988/06/02,4.287,50.959,Meise
Nationale Plantentuin van België,Beschermd cultuurhistorisch landschap,1967/08/09,4.327,50.928,Meise
Dijlevallei - Pikhakendonk,Beschermd cultuurhistorisch landschap,2002/06/20,4.576,50.994,Boortmeerbeek
Pastorie Onze-Lieve-Vrouwparochie: omgeving,Beschermd cultuurhistorisch landschap,1976/09/13,4.556,50.994,Boortmeerbeek
Watermolen en molenaarswoning met omgeving,Beschermd stads- of dorpsgezicht,1991/06/14,4.571,50.983,Boortmeerbeek
Domein Kaasterkasteel: park,Beschermd cultuurhistorisch landschap,1969/08/12,3.136,50.927,Roeselare
Kasteel Rodenbach-Mergaert: tuin,Beschermd stads- of dorpsgezicht,2002/02/20,3.138,50.945,Roeselare
Baljuwhuis Goudenhooft: omgeving,Beschermd cultuurhistorisch landschap,1976/10/14,3.153,50.933,Roeselare
Hoeve Slagmolenhof met omgeving,Beschermd stads- of dorpsgezicht,1981/10/23,4.235,50.953,Merchtem
Onderwijzerswoning: omgeving,Beschermd stads- of dorpsgezicht,2001/02/23,4.234,50.960,Merchtem
Kerk en Pastorie Sint-Stefanusparochie: omgeving,Beschermd cultuurhistorisch landschap,1976/09/13,4.268,50.927,Merchtem
Gesloten hoeve Torenhof: omgeving,Beschermd cultuurhistorisch landschap,1976/11/25,4.267,50.929,Merchtem
Watermolen Cortvrindtmolen of Neerkammolen met omgeving,Beschermd stads- of dorpsgezicht,1994/03/10,4.227,50.933,Merchtem
Parochiekerk Onze-Lieve-Vrouw en omgeving,Beschermd cultuurhistorisch landschap,1947/12/10,4.276,50.915,Merchtem
Pastorie Sint-Jan-de-Doperparochie: tuin,Beschermd cultuurhistorisch landschap,1976/09/13,4.278,50.922,Merchtem
Hoeve 't Hof Tiendeschuur met omgeving,Beschermd stads- of dorpsgezicht,1990/01/10,4.235,50.965,Merchtem
Semi-gesloten hoeve Hof te Hamme met omgeving,Beschermd stads- of dorpsgezicht,1986/08/01,4.285,50.916,Merchtem
Hof ten Houte: omgeving,Beschermd stads- of dorpsgezicht,2003/05/21,4.203,50.980,Merchtem
Twee stadswoningen,Beschermd stads- of dorpsgezicht,1997/10/23,4.042,50.937,Aalst
Keizersplein met aanpalende bebouwing,Beschermd stads- of dorpsgezicht,2000/03/14,4.036,50.936,Aalst
Hof te Mutsereel met omgeving,Beschermd stads- of dorpsgezicht,1997/11/07,4.140,50.936,Aalst
Sashuis met omgeving,Beschermd stads- of dorpsgezicht,2001/06/06,4.068,50.986,Aalst
Opgaande beuk bij woning Eeman,Beschermd cultuurhistorisch landschap,1975/05/07,4.039,50.939,Aalst
Oud-Hospitaal: beuk,Beschermd cultuurhistorisch landschap,1975/05/07,4.042,50.938,Aalst
Stadspark Groot Park,Beschermd cultuurhistorisch landschap,1977/03/09,4.047,50.930,Aalst
Zomereik met omgeving,Beschermd stads- of dorpsgezicht,1990/03/02,4.127,50.963,Aalst
Hotel van Langenhove met omgeving,Beschermd cultuurhistorisch landschap,1962/09/21,4.039,50.939,Aalst
Osbroek,Beschermd cultuurhistorisch landschap,1977/11/30,4.043,50.924,Aalst
Stadhuis van Aalst,Beschermd stads- of dorpsgezicht,1991/06/19,4.039,50.939,Aalst
Sint-Jobkapel: omgeving,Beschermd cultuurhistorisch landschap,1975/10/22,4.026,50.931,Aalst
Pastorie Onze-Lieve-Vrouwparochie met tuin,Beschermd cultuurhistorisch landschap,1976/11/09,4.005,50.922,Aalst
Kasteel van Muylem met omgeving,Beschermd stads- of dorpsgezicht,1981/04/15,4.009,50.940,Aalst
Kapel Sint-Rochus met omgeving,Beschermd stads- of dorpsgezicht,1986/07/25,4.121,50.927,Aalst
"Kasteeldomein Terlinden: 20ste-eeuwse verbouwingen, erekoer, kasteelhoeve en park",Beschermd stads- of dorpsgezicht,1987/07/02,4.015,50.943,Aalst
Onze-Lieve-Vrouwhospitaal,Beschermd stads- of dorpsgezicht,1991/06/19,4.043,50.938,Aalst
Kasteel van Gijzegem met omgeving,Beschermd stads- of dorpsgezicht,1991/09/30,4.040,50.991,Aalst
Kravaalbos en omgeving,Beschermd cultuurhistorisch landschap,1980/10/13,4.156,50.932,Aalst
Pastorie Sint-Hubertusparochie: pastorietuin,Beschermd cultuurhistorisch landschap,1974/04/23,4.677,50.956,Haacht
Dorpskern Tildonk,Beschermd stads- of dorpsgezicht,2002/06/14,4.644,50.945,Haacht
Kasteeltje van Tildonk: omgeving,Beschermd stads- of dorpsgezicht,2002/06/25,4.652,50.947,Haacht
Dorpskern Wespelaar,Beschermd stads- of dorpsgezicht,2017/03/30,4.634,50.959,Haacht
Hoeve Craeneveld: omgeving,Beschermd cultuurhistorisch landschap,1977/03/09,4.675,50.966,Haacht
Valvekenshoeve met omgeving,Beschermd stads- of dorpsgezicht,1981/04/13,4.596,50.989,Haacht
Dubbele schutsluis en sluiswachterswoning met omgeving,Beschermd stads- of dorpsgezicht,1996/07/08,4.666,50.940,Haacht
Sint-Annakapel: omgeving,Beschermd stads- of dorpsgezicht,1986/10/17,3.666,50.970,Nazareth
Burgerlijk Godshuis,Beschermd stads- of dorpsgezicht,1998/06/09,3.600,50.959,Nazareth
Hoeve Tesseshof: omgeving,Beschermd stads- of dorpsgezicht,1998/01/27,4.167,50.971,Opwijk
Molenkouter,Beschermd stads- of dorpsgezicht,1999/02/04,4.175,50.944,Opwijk
Watermolen op de Molenbeek met omgeving,Beschermd cultuurhistorisch landschap,1973/10/18,3.951,50.954,Lede
"Parochiekerk Sint-Michiel, Cornelius en Ghislenus met pastorie en omgeving",Beschermd stads- of dorpsgezicht,1979/09/11,3.484,50.960,Zulte
Domein Kasteel van Olsene,Beschermd stads- of dorpsgezicht,1995/11/10,3.473,50.939,Zulte
Manege de Ribaucourt en Villa Salomé met omgeving,Beschermd stads- of dorpsgezicht,1994/04/22,3.449,50.909,Zulte
"Windmolen Hostensmolen met molenerf, molenaarswoning en bedrijfsgebouwen",Beschermd stads- of dorpsgezicht,1999/12/13,3.485,50.958,Zulte
Drielindenkapel met linden en omgeving,Beschermd stads- of dorpsgezicht,1994/11/09,4.729,50.945,Rotselaar
Abdij van Vrouwenpark: park,Beschermd stads- of dorpsgezicht,1998/10/01,4.736,50.943,Rotselaar
Kasteel van Terheiden met omgeving,Beschermd cultuurhistorisch landschap,1949/02/18,4.722,50.958,Rotselaar
Parochiekerk Sint-Martinus met kerkhof,Beschermd cultuurhistorisch landschap,1948/07/19,4.756,50.948,Rotselaar
Dorpskern Wezemaal,Beschermd stads- of dorpsgezicht,1982/04/02,4.755,50.947,Rotselaar
Watermolen Uitheemse Molen met omgeving,Beschermd stads- of dorpsgezicht,1994/04/18,4.774,50.937,Rotselaar
Maalderij Van Dooren met omgeving,Beschermd stads- of dorpsgezicht,1983/06/22,4.703,50.947,Rotselaar
Brouwerij Mena en bijgebouwen,Beschermd stads- of dorpsgezicht,1994/05/24,4.712,50.951,Rotselaar
Kapel Onze-Lieve-Vrouw van de Akker met linden,Beschermd stads- of dorpsgezicht,1994/11/09,4.715,50.953,Rotselaar
Kapel Onze-Lieve-Vrouw van Zeven-Smarten met omgeving,Beschermd cultuurhistorisch landschap,1948/07/15,4.742,50.960,Rotselaar
Wijngaardberg,Beschermd cultuurhistorisch landschap,1977/11/21,4.772,50.953,Rotselaar
Pastorie Sint-Petrusparochie en tuin,Beschermd stads- of dorpsgezicht,1991/11/18,4.709,50.953,Rotselaar
Beningsberg,Beschermd cultuurhistorisch landschap,1977/01/11,4.792,50.947,Rotselaar
Dorpskom Wakken,Beschermd stads- of dorpsgezicht,1998/01/14,3.401,50.931,Dentergem
Kasteeldomein Ter Borcht,Beschermd stads- of dorpsgezicht,2004/04/15,3.278,50.947,Meulebeke
Onze-Lieve-Vrouw-van-Bijstandkapel met omgeving,Beschermd stads- of dorpsgezicht,2004/04/15,3.282,50.941,Meulebeke
Hoeve en landbouwstokerij Betsberg met omgeving,Beschermd stads- of dorpsgezicht,1981/10/23,3.808,50.962,Oosterzele
Hoeve met aanhorigheden en omgeving,Beschermd stads- of dorpsgezicht,1997/09/22,3.819,50.974,Oosterzele
Hoeve Waterhof met omgeving,Beschermd stads- of dorpsgezicht,1983/03/02,3.811,50.901,Oosterzele
Hof ter Loo met watermolen met omgeving,Beschermd stads- of dorpsgezicht,1993/04/21,3.784,50.962,Oosterzele
"Sluis, sluiswachterswoning en omgeving",Beschermd stads- of dorpsgezicht,1997/03/19,4.593,50.956,Kampenhout
Dorpskern Nederokkerzeel,Beschermd stads- of dorpsgezicht,2000/02/03,4.565,50.919,Kampenhout
Hoeve Spaans Hof: omgeving,Beschermd cultuurhistorisch landschap,1975/10/14,4.563,50.923,Kampenhout
Hoeve Het Roodt Cruys met omgeving,Beschermd stads- of dorpsgezicht,1981/09/29,4.545,50.923,Kampenhout
Kasteel Ter Loonst en omgeving,Beschermd cultuurhistorisch landschap,1971/05/27,4.589,50.942,Kampenhout
Afspanning Op het Santvliet met omgeving,Beschermd stads- of dorpsgezicht,1985/01/03,4.580,50.945,Kampenhout
Torfbroek en omgeving,Beschermd cultuurhistorisch landschap,1996/03/06,4.543,50.925,Kampenhout
Dorpskern Kampenhout,Beschermd stads- of dorpsgezicht,1994/04/18,4.548,50.941,Kampenhout
Domein Ter Bronnen,Beschermd cultuurhistorisch landschap,1995/11/10,4.552,50.930,Kampenhout
Hoeve Het Noordhof: weilanden en oprijlaan,Beschermd stads- of dorpsgezicht,2008/12/08,2.733,50.945,Vleteren
Parochiekerk Sint-Martinus met omgeving,Beschermd stads- of dorpsgezicht,1981/10/23,4.907,50.929,Tielt-Winge
Kasteeldomein van Sint-Joris-Winge,Beschermd cultuurhistorisch landschap,1962/09/21,4.872,50.910,Tielt-Winge
Walenbos en omgeving: fase 2,Beschermd cultuurhistorisch landschap,1981/05/06,4.890,50.936,Tielt-Winge
Afspanning Het Stenen Huis: omgeving,Beschermd stads- of dorpsgezicht,2002/06/14,4.929,50.933,Tielt-Winge
Dorpskern Meensel-Kiezegem,Beschermd stads- of dorpsgezicht,1999/10/28,4.924,50.896,Tielt-Winge
Herberg van 1781: omgeving,Beschermd stads- of dorpsgezicht,2001/02/23,4.905,50.918,Tielt-Winge
Parochiekerk Sint-Maurus en pastorie: omgeving,Beschermd cultuurhistorisch landschap,1976/09/13,4.756,50.921,Holsbeek
Hoeve Heilig Geesthof en omgeving,Beschermd stads- of dorpsgezicht,1993/11/10,4.773,50.922,Holsbeek
Kasteel van Horst met omgeving,Beschermd cultuurhistorisch landschap,1971/05/27,4.831,50.934,Holsbeek
Wingevallei en omgeving van de  pastorie Sint-Pieters-Rode,Beschermd cultuurhistorisch landschap,2004/10/15,4.819,50.938,Holsbeek
Kasteel van Horst met omgeving,Beschermd cultuurhistorisch landschap,2007/03/26,4.834,50.934,Holsbeek
Kasteeldomein Blauwhuis,Beschermd stads- of dorpsgezicht,1981/02/02,3.223,50.919,Izegem
"Stadhuis Izegem, stadswoningen en burgerhuizen",Beschermd stads- of dorpsgezicht,1981/02/02,3.214,50.920,Izegem
Pastorie Sint-Niklaasparochie met omgeving,Beschermd stads- of dorpsgezicht,1981/07/03,4.496,50.935,Steenokkerzeel
Hoeve Drie Torens met omgeving,Beschermd cultuurhistorisch landschap,1973/11/20,4.483,50.937,Steenokkerzeel
Dorpskom Perk,Beschermd stads- of dorpsgezicht,1981/07/03,4.505,50.931,Steenokkerzeel
Dorpskom Humelgem,Beschermd stads- of dorpsgezicht,1982/09/22,4.516,50.902,Steenokkerzeel
Floordambos,Beschermd cultuurhistorisch landschap,1991/06/26,4.476,50.923,Steenokkerzeel
Dorpskom Baaigem,Beschermd stads- of dorpsgezicht,1982/07/30,3.718,50.934,Gavere
Kasteeldomein Borgwal,Beschermd stads- of dorpsgezicht,1981/01/13,3.687,50.948,Gavere
Dorpskom Semmerzake,Beschermd stads- of dorpsgezicht,1982/06/16,3.663,50.943,Gavere
Windmolen Tarandusmolen: omgeving,Beschermd stads- of dorpsgezicht,1986/10/13,3.721,50.912,Gavere
Watermolen Ratmolen met omgeving,Beschermd stads- of dorpsgezicht,1994/02/17,3.932,50.886,Erpe-Mere
Watermolen Ten Boeck met omgeving,Beschermd stads- of dorpsgezicht,1994/02/17,3.959,50.914,Erpe-Mere
Watermolen met omgeving,Beschermd stads- of dorpsgezicht,1994/02/17,3.943,50.934,Erpe-Mere
Vallei van de Molenbeek: fase 1,Beschermd cultuurhistorisch landschap,2004/11/05,3.958,50.909,Erpe-Mere
Honegem - Solegem - Sint-Apollonia,Beschermd cultuurhistorisch landschap,1999/12/23,4.003,50.953,Erpe-Mere
Honegem - Solegem - Sint-Apollonia,Beschermd cultuurhistorisch landschap,1990/07/02,4.003,50.953,Erpe-Mere
Dikke Kapel met omgeving,Beschermd cultuurhistorisch landschap,1975/05/27,3.968,50.917,Erpe-Mere
Pastorie Sint-Bavoparochie: omgeving,Beschermd cultuurhistorisch landschap,1976/01/13,3.972,50.922,Erpe-Mere
Dorpskern Aaigem,Beschermd stads- of dorpsgezicht,1978/02/21,3.936,50.889,Erpe-Mere
Watermolen Gotegemmolen met omgeving,Beschermd stads- of dorpsgezicht,1993/04/21,3.962,50.903,Erpe-Mere
Opgaande Hollandse linde als kruispuntboom,Beschermd cultuurhistorisch landschap,1957/07/06,3.883,50.945,Sint-Lievens-Houtem
Korenwatermolen en omgeving,Beschermd stads- of dorpsgezicht,1994/02/17,3.861,50.923,Sint-Lievens-Houtem
Sint-Lievenskapel: perceel met Sint-Lievensbron,Beschermd stads- of dorpsgezicht,1995/10/24,3.867,50.915,Sint-Lievens-Houtem
Hoeve Sint-Pietershof: omgeving,Beschermd stads- of dorpsgezicht,1995/01/03,3.880,50.926,Sint-Lievens-Houtem
Kasteeldomein van Ingelmunster,Beschermd cultuurhistorisch landschap,1947/06/20,3.256,50.918,Ingelmunster
Gemeentelijke begraafplaats,Beschermd stads- of dorpsgezicht,2002/11/13,3.257,50.922,Ingelmunster
Dorpskom Reningelst,Beschermd stads- of dorpsgezicht,1998/11/26,2.766,50.817,Poperinge
Hoeve Ter Winterbeek: erf en omgeving,Beschermd stads- of dorpsgezicht,1987/01/26,2.704,50.826,Poperinge
Kasteeldomein De Lovie met park,Beschermd stads- of dorpsgezicht,2000/02/03,2.696,50.880,Poperinge
Hoeve met hopast en omgeving,Beschermd stads- of dorpsgezicht,2010/02/09,2.678,50.846,Poperinge
Hoeve met omgeving,Beschermd stads- of dorpsgezicht,2010/02/09,2.699,50.840,Poperinge
Hoeve met omgeving,Beschermd stads- of dorpsgezicht,1985/11/28,2.646,50.857,Poperinge
Hoeve met omgeving,Beschermd stads- of dorpsgezicht,1985/11/28,2.665,50.863,Poperinge
Hoeve Korte Wilde met omgeving,Beschermd stads- of dorpsgezicht,1985/11/28,2.632,50.841,Poperinge
Hoeve Abelehof met omgeving,Beschermd stads- of dorpsgezicht,1987/01/26,2.723,50.877,Poperinge
Schipvaarthoeve: omgeving,Beschermd stads- of dorpsgezicht,1987/01/26,2.739,50.862,Poperinge
Herenhoeve: omgeving,Beschermd stads- of dorpsgezicht,2003/05/09,2.712,50.865,Poperinge
Veldkapel Onze-Lieve-Heertjesbos met omgeving,Beschermd stads- of dorpsgezicht,1987/01/26,2.693,50.855,Poperinge
Dorpskom Watou,Beschermd stads- of dorpsgezicht,1985/07/03,2.619,50.858,Poperinge
Dorpskern Haringe,Beschermd stads- of dorpsgezicht,1993/07/16,2.618,50.907,Poperinge
Vismarkt en omgeving,Beschermd stads- of dorpsgezicht,1980/08/19,2.884,50.850,Ieper
Ensemble met architectenwoning Jules Coomans,Beschermd stads- of dorpsgezicht,1994/07/14,2.877,50.849,Ieper
Geschilderde muuradvertentie voor Haig House: omgeving,Beschermd stads- of dorpsgezicht,2013/07/18,2.871,50.849,Ieper
Molenaarswoning en molenromp met omgeving,Beschermd cultuurhistorisch landschap,1975/05/27,2.816,50.882,Ieper
Gezelleplein,Beschermd cultuurhistorisch landschap,1976/02/24,2.890,50.850,Ieper
Hoeve Buurloofhof met omgeving,Beschermd stads- of dorpsgezicht,1985/06/08,2.851,50.859,Ieper
Parochiekerk Sint-Michiel met omgeving,Beschermd stads- of dorpsgezicht,1979/07/17,4.613,50.902,Herent
Watermolen Heersemmolen en hoevecomplex met omgeving,Beschermd stads- of dorpsgezicht,1993/07/16,4.610,50.912,Herent
Gesloten hoeve Duigemhof en omgeving,Beschermd cultuurhistorisch landschap,1976/11/18,4.656,50.907,Herent
Parochiekerk Onze-Lieve-Vrouw met omgeving,Beschermd cultuurhistorisch landschap,1976/05/13,4.644,50.898,Herent
Domein de Morette,Beschermd cultuurhistorisch landschap,1987/12/27,4.168,50.892,Asse
Domein Waalborre,Beschermd stads- of dorpsgezicht,2000/12/08,4.205,50.905,Asse
Dorpskern Bekkerzeel,Beschermd stads- of dorpsgezicht,2002/11/13,4.238,50.884,Asse
Hoeve Hoge Kamer met omgeving,Beschermd stads- of dorpsgezicht,1985/01/24,4.172,50.906,Asse
Hoeve Hof te Asbeek met omgeving,Beschermd stads- of dorpsgezicht,1985/01/24,4.164,50.902,Asse
Kruisborrekapel met omgeving,Beschermd cultuurhistorisch landschap,1962/05/28,4.179,50.895,Asse
Centrum Bollebeek,Beschermd stads- of dorpsgezicht,1980/01/10,4.239,50.919,Asse
Dorpskom Mollem,Beschermd stads- of dorpsgezicht,1980/01/10,4.227,50.931,Asse
Hoeve Hof Ter Kalken met omgeving,Beschermd stads- of dorpsgezicht,1980/07/18,4.208,50.933,Asse
Parochiekerk Sint-Bavo: kerkhof met omheiningsmuur,Beschermd cultuurhistorisch landschap,1938/03/25,4.263,50.886,Asse
Hoeve Hooghof: uitbreiding omgeving,Beschermd stads- of dorpsgezicht,1980/07/18,4.293,50.885,Asse
Hoeve Hooghof met omgeving,Beschermd stads- of dorpsgezicht,1983/02/03,4.289,50.889,Asse
Kasteel van Zellik met omgeving,Beschermd stads- of dorpsgezicht,1987/03/23,4.262,50.884,Asse
Arbeiderswoningen Blauwputgang en handelsgebouw,Beschermd stads- of dorpsgezicht,1989/07/23,4.712,50.882,Leuven
Bondgenotenlaan,Beschermd stads- of dorpsgezicht,2015/06/04,4.709,50.880,Leuven
Ommuurde kloostertuin en aanpalende schoolvleugels,Beschermd stads- of dorpsgezicht,2006/12/21,4.696,50.876,Leuven
"Klooster der montfortanen, secretariaat en eclectische burgerhuizen",Beschermd stads- of dorpsgezicht,1996/07/09,4.709,50.885,Leuven
Villerscollege en omgeving,Beschermd stads- of dorpsgezicht,1994/11/09,4.702,50.881,Leuven
Kolveniershof en aansluitende steeg,Beschermd stads- of dorpsgezicht,1994/11/09,4.702,50.883,Leuven
Oude Markt en onmiddellijke omgeving,Beschermd stads- of dorpsgezicht,1994/11/09,4.700,50.878,Leuven
Justus Lipsiuscollege met tuin,Beschermd stads- of dorpsgezicht,1994/06/07,4.694,50.877,Leuven
Kapel Onze-Lieve-Vrouw ter Koorts en minderbroedersklooster met omgeving,Beschermd stads- of dorpsgezicht,1994/05/24,4.704,50.875,Leuven
Schoolsite stadsschool n°7,Beschermd stads- of dorpsgezicht,2010/04/16,4.704,50.871,Leuven
Atrechtcollege: koer,Beschermd cultuurhistorisch landschap,1974/10/15,4.700,50.875,Leuven
Heilige Geestgoed Sint-Kwintensparochie en ommuurde pastorietuin,Beschermd stads- of dorpsgezicht,1990/02/06,4.700,50.870,Leuven
Parochiekerk Sint-Jacob met omgeving,Beschermd stads- of dorpsgezicht,1987/01/12,4.691,50.881,Leuven
Woonhuis Goed Groenendael met omgeving,Beschermd stads- of dorpsgezicht,1989/04/27,4.694,50.875,Leuven
Erasme Ruelensvest en Leo Dartelaan,Beschermd stads- of dorpsgezicht,2013/07/17,4.706,50.868,Leuven
Sint-Jacobsplein met aanpalende straten,Beschermd stads- of dorpsgezicht,1995/03/08,4.691,50.880,Leuven
Zwartzusterklooster,Beschermd stads- of dorpsgezicht,1986/10/13,4.698,50.873,Leuven
Predikherenstraat,Beschermd stads- of dorpsgezicht,1986/10/13,4.697,50.880,Leuven
Domein patriciërsfamilie Van 't Sestich,Beschermd stads- of dorpsgezicht,1986/07/15,4.701,50.875,Leuven
Hogeschoolplein,Beschermd stads- of dorpsgezicht,2016/09/21,4.702,50.877,Leuven
Grote Markt,Beschermd stads- of dorpsgezicht,2016/12/15,4.701,50.879,Leuven
Sint-Geertruidabdij en omgeving,Beschermd stads- of dorpsgezicht,1985/11/06,4.700,50.884,Leuven
Burgerhuizen en stadswoningen,Beschermd stads- of dorpsgezicht,1982/04/02,4.698,50.878,Leuven
Classicistische herenhuizen met omgeving,Beschermd stads- of dorpsgezicht,1981/07/03,4.702,50.883,Leuven
Stadspark Sint-Donatius,Beschermd stads- of dorpsgezicht,1978/03/01,4.703,50.876,Leuven
Stedelijke kruidtuin,Beschermd cultuurhistorisch landschap,1976/07/06,4.690,50.878,Leuven
Eerste stadsomwalling: Handbooghof,Beschermd cultuurhistorisch landschap,1945/10/30,4.696,50.881,Leuven
Onze-Lieve-Vrouw-ten-predikherenkerk: omgeving,Beschermd cultuurhistorisch landschap,1948/07/15,4.696,50.879,Leuven
Villa Les Tilleuls en omgeving,Beschermd stads- of dorpsgezicht,1978/12/08,4.696,50.855,Leuven
Kartuizerij van Terbank: tuin en Mariapark,Beschermd cultuurhistorisch landschap,1976/07/09,4.687,50.875,Leuven
Arenbergpark en omgeving,Beschermd stads- of dorpsgezicht,1980/12/23,4.687,50.865,Leuven
Burgerhuis De Fontein met omgeving,Beschermd stads- of dorpsgezicht,1987/01/12,4.698,50.880,Leuven
Abdij van Vlierbeek,Beschermd cultuurhistorisch landschap,1939/02/20,4.736,50.892,Leuven
Norbertijnenabdij van Park: uitbreiding omgeving,Beschermd cultuurhistorisch landschap,2007/02/16,4.723,50.861,Leuven
Dominicanessenklooster van Terbank,Beschermd stads- of dorpsgezicht,1980/07/18,4.674,50.874,Leuven
Abdij van Park met omgeving en vijvers,Beschermd cultuurhistorisch landschap,1942/07/03,4.718,50.865,Leuven
Tweede stadsomwalling van Leuven: deel Naamsevest,Beschermd stads- of dorpsgezicht,1998/10/19,4.703,50.868,Leuven
Tweede stadsomwalling van Leuven: deel Edouard Remyvest,Beschermd stads- of dorpsgezicht,1998/10/19,4.683,50.881,Leuven
Lei,Beschermd stads- of dorpsgezicht,2000/01/27,4.696,50.881,Leuven
Abdij van Vlierbeek: omgeving,Beschermd stads- of dorpsgezicht,2001/02/23,4.739,50.894,Leuven
Hoger Instituut voor Wijsbegeerte en Seminarie Leo XIII: site en onmiddellijke omgeving,Beschermd stads- of dorpsgezicht,2003/10/15,4.707,50.876,Leuven
Vigliuscollege,Beschermd stads- of dorpsgezicht,2009/10/16,4.700,50.873,Leuven
Site van de Speciale Scholen voor Ingenieurs,Beschermd stads- of dorpsgezicht,2010/05/05,4.684,50.861,Leuven
"Instituut voor Lichamelijke Opvoeding: cafetaria, conciërgewoning en omgeving",Beschermd stads- of dorpsgezicht,2010/05/05,4.692,50.869,Leuven
Minderbroedersstraat: gedeelte tussen Kapucijnenvoer en zuidelijke Dijle-arm,Beschermd stads- of dorpsgezicht,2011/07/22,4.693,50.877,Leuven
Martelarenplein en omgeving,Beschermd stads- of dorpsgezicht,1997/10/23,4.714,50.881,Leuven
Kesselberg,Beschermd cultuurhistorisch landschap,1973/12/14,4.725,50.906,Leuven
Technische School,Beschermd stads- of dorpsgezicht,1990/12/14,4.704,50.881,Leuven
Celestijnenhoeve en priorij met omgeving,Beschermd stads- of dorpsgezicht,1978/06/16,4.681,50.860,Leuven
Dorpskom Zonnebeke,Beschermd stads- of dorpsgezicht,1994/01/14,2.988,50.873,Zonnebeke
Hoeve met omgeving,Beschermd stads- of dorpsgezicht,1995/05/30,2.986,50.893,Zonnebeke
Domein Eikelenhof,Beschermd cultuurhistorisch landschap,2018/11/23,4.546,50.880,Kortenberg
Ensemble van eclectische villa's,Beschermd stads- of dorpsgezicht,2013/05/30,4.550,50.897,Kortenberg
Parochiekerk Sint-Martinus en omgeving,Beschermd stads- of dorpsgezicht,1994/12/19,4.570,50.878,Kortenberg
Kasteel Hof ter Bruggen en omgeving,Beschermd stads- of dorpsgezicht,1993/01/14,4.564,50.905,Kortenberg
Ensemble van villa's,Beschermd stads- of dorpsgezicht,2000/03/14,4.549,50.888,Kortenberg
Kluiskapel met omgeving,Beschermd stads- of dorpsgezicht,1985/01/24,4.092,50.926,Affligem
Watermolen Bellemolen met omgeving,Beschermd stads- of dorpsgezicht,1986/03/14,4.117,50.889,Affligem
Pastorie Onze-Lieve-Vrouwparochie: tuin,Beschermd cultuurhistorisch landschap,1975/10/22,4.137,50.902,Affligem
Kasteel van Wemmel met omgeving,Beschermd cultuurhistorisch landschap,1953/08/13,4.304,50.908,Wemmel
Parochiekerk Sint-Servatius met oud kerkhof en omheiningsmuur,Beschermd cultuurhistorisch landschap,1947/09/24,4.302,50.910,Wemmel
Kasteeldomein van Leeuwergem,Beschermd cultuurhistorisch landschap,1973/07/10,3.821,50.888,Zottegem
Hof De Moriaan en omgeving,Beschermd stads- of dorpsgezicht,1978/06/16,3.757,50.873,Zottegem
Parochiekerk Sint-Andries en omgeving,Beschermd stads- of dorpsgezicht,1979/03/28,3.788,50.868,Zottegem
Pastorie met tuin,Beschermd stads- of dorpsgezicht,1980/10/01,3.782,50.887,Zottegem
Dorpskern Velzeke-Ruddershove,Beschermd stads- of dorpsgezicht,1979/09/11,3.781,50.882,Zottegem
Dorpskern Godveerdegem,Beschermd stads- of dorpsgezicht,1979/09/11,3.821,50.859,Zottegem
Hoeve in U-vorm met omgeving,Beschermd stads- of dorpsgezicht,1979/10/04,3.860,50.873,Zottegem
Dorpskern Leeuwergem,Beschermd stads- of dorpsgezicht,1980/03/04,3.829,50.888,Zottegem
Munkboshoeven en omgeving: fase 1,Beschermd cultuurhistorisch landschap,1977/12/23,3.763,50.912,Zottegem
Munkboshoeven en omgeving: fase 2,Beschermd cultuurhistorisch landschap,1980/03/25,3.763,50.911,Zottegem
Afspanning Posterij met omgeving,Beschermd stads- of dorpsgezicht,1980/08/19,3.838,50.870,Zottegem
Villa met omgeving,Beschermd stads- of dorpsgezicht,1981/05/22,3.813,50.864,Zottegem
Stadskern Zottegem,Beschermd stads- of dorpsgezicht,1981/05/22,3.810,50.870,Zottegem
Windmolen met omgeving,Beschermd stads- of dorpsgezicht,1979/06/21,3.844,50.874,Zottegem
Watermolen en gesloten hoeve met omgeving,Beschermd stads- of dorpsgezicht,1983/12/07,3.781,50.879,Zottegem
Hoeve Hof te Wassenhove met omgeving,Beschermd stads- of dorpsgezicht,1979/03/28,3.844,50.882,Zottegem
Dorpskern Sint-Goriks-Oudenhove,Beschermd stads- of dorpsgezicht,1979/03/22,3.786,50.852,Zottegem
Gesloten hoeve met watermolen en omgeving,Beschermd stads- of dorpsgezicht,1981/09/08,3.788,50.865,Zottegem
"Stadswoningen, burgerhuizen en herenhuis",Beschermd stads- of dorpsgezicht,2001/02/23,3.814,50.872,Zottegem
Pastorie: omgeving,Beschermd stads- of dorpsgezicht,1994/06/24,3.822,50.859,Zottegem
Zevensacramentenboom,Beschermd cultuurhistorisch landschap,1977/01/28,3.831,50.889,Zottegem
Kasseiweg Paddestraat,Beschermd cultuurhistorisch landschap,1981/04/02,3.764,50.876,Zottegem
Kasteeldomein Breivelde,Beschermd cultuurhistorisch landschap,1982/07/02,3.831,50.871,Zottegem
Kasteelhoeve: woonhuis en molenhuis,Beschermd stads- of dorpsgezicht,1995/09/08,3.806,50.873,Zottegem
Kasteelhoeve: platform met overwelfde kelder,Beschermd stads- of dorpsgezicht,1995/09/08,3.805,50.874,Zottegem
Kasteelhoeve en omgeving,Beschermd stads- of dorpsgezicht,1995/09/08,3.806,50.874,Zottegem
Stenen windmolen met omgeving,Beschermd stads- of dorpsgezicht,1979/03/13,3.814,50.889,Zottegem
Dorpskern Elene,Beschermd stads- of dorpsgezicht,1981/05/20,3.810,50.889,Zottegem
Hoeve Hof ter Linden en omgeving,Beschermd stads- of dorpsgezicht,1979/05/10,3.776,50.892,Zottegem
Ledebergstraat en omgeving,Beschermd stads- of dorpsgezicht,1981/05/22,3.806,50.867,Zottegem
