NAAM,TYPE_NAAM,GELD_START,LON,LAT,GEMEENTE
De Liereman: fasen 2 en 3,Beschermd cultuurhistorisch landschap,1984/11/23,5.040,51.332,Arendonk
"De Liereman-fase 1: moerassen, vennen en heide",Beschermd cultuurhistorisch landschap,1940/03/08,5.017,51.338,Oud-Turnhout
De Liereman-fase 1: uitbreiding,Beschermd cultuurhistorisch landschap,2006/02/23,5.011,51.338,Oud-Turnhout
Abdij van Postel,Beschermd stads- of dorpsgezicht,1997/02/13,5.190,51.289,Mol
Laagveengebied,Beschermd cultuurhistorisch landschap,2000/05/15,5.171,51.214,Mol
Buitengoor - Meergoor,Beschermd cultuurhistorisch landschap,1982/07/02,5.171,51.214,Mol
De Ronde Put en omgeving,Beschermd cultuurhistorisch landschap,1993/07/06,5.158,51.287,Mol
"Parochiekerk Sint-Jozef met pastorie, Lourdesgrot en bidtuin het Sint-Jozefshofke",Beschermd stads- of dorpsgezicht,2009/07/06,5.222,51.196,Mol
Bossen en plassen van Den Diel met sluis 3,Beschermd cultuurhistorisch landschap,2004/06/22,5.200,51.243,Mol
Kanaal Bocholt-Herentals met sluizen,Beschermd stads- of dorpsgezicht,1999/10/06,5.209,51.238,Mol
"Oorlogsmonument, scholen, klooster, elektriciteitscabine en pastorie",Beschermd stads- of dorpsgezicht,2004/01/16,5.479,51.256,Hamont-Achel
Beverbeekhoeve,Beschermd stads- of dorpsgezicht,1980/07/18,5.514,51.279,Hamont-Achel
Windmolen Napoleonsmolen en omgeving,Beschermd stads- of dorpsgezicht,1982/03/31,5.539,51.251,Hamont-Achel
Tomp van Grevenbos met omgeving,Beschermd cultuurhistorisch landschap,1947/09/24,5.497,51.267,Hamont-Achel
Huizen Rijcken en Cuppens met tuinen,Beschermd stads- of dorpsgezicht,1997/02/13,5.546,51.252,Hamont-Achel
Huis Gijbels met tuin,Beschermd stads- of dorpsgezicht,1997/02/13,5.545,51.251,Hamont-Achel
Huis Spaas met tuin,Beschermd stads- of dorpsgezicht,1997/02/13,5.544,51.251,Hamont-Achel
Huis Simons met tuin,Beschermd stads- of dorpsgezicht,1997/02/13,5.542,51.250,Hamont-Achel
Huis Geusens met tuin,Beschermd stads- of dorpsgezicht,1997/02/13,5.543,51.250,Hamont-Achel
Huis Engelen met tuin,Beschermd stads- of dorpsgezicht,1997/02/13,5.546,51.251,Hamont-Achel
Watermolen met omgeving,Beschermd cultuurhistorisch landschap,1975/07/04,5.052,51.243,Retie
Windmolen De Heerser: omgeving,Beschermd cultuurhistorisch landschap,1976/12/06,5.072,51.280,Retie
Pastorie Sint-Martinusparochie met omgeving,Beschermd stads- of dorpsgezicht,1987/01/16,5.082,51.267,Retie
Kapel Onze-Lieve-Vrouw ter Sneeuw met omgeving,Beschermd cultuurhistorisch landschap,1952/01/29,5.100,51.258,Retie
Sint-Pieterskapel met omgeving,Beschermd cultuurhistorisch landschap,1957/07/06,5.076,51.264,Retie
Etagelinde op dorpsplein Retie,Beschermd cultuurhistorisch landschap,1951/02/19,5.084,51.267,Retie
Hoeve Spooren: omgeving,Beschermd stads- of dorpsgezicht,2002/05/23,5.335,51.227,Lommel
Hoeve De Groote Hoef: omgeving,Beschermd cultuurhistorisch landschap,1974/03/21,5.325,51.222,Lommel
Marktplein,Beschermd cultuurhistorisch landschap,1974/03/29,5.308,51.231,Lommel
Hageven,Beschermd cultuurhistorisch landschap,1985/06/08,5.414,51.261,Lommel
Vloeiweiden,Beschermd cultuurhistorisch landschap,2003/05/20,5.355,51.266,Lommel
Hoeve De Boeretang met omwalling en omgeving,Beschermd cultuurhistorisch landschap,1976/10/14,5.091,51.234,Dessel
Het Goor,Beschermd cultuurhistorisch landschap,1993/07/06,5.148,51.262,Dessel
Damburghoeve met omgeving,Beschermd stads- of dorpsgezicht,1987/01/26,5.572,51.168,Bocholt
Watermolen Luysmolen met omgeving,Beschermd stads- of dorpsgezicht,1994/12/28,5.631,51.179,Bocholt
Windmolen type grondzeiler: omgeving,Beschermd stads- of dorpsgezicht,1994/10/12,5.514,51.188,Bocholt
Parochiekerk Sint-Willibrordus met omgeving,Beschermd stads- of dorpsgezicht,1985/01/17,5.562,51.155,Bocholt
Watermolen Reppelmolen: omgeving,Beschermd stads- of dorpsgezicht,1997/10/23,5.558,51.154,Bocholt
Watermolen Binkenmolen met omgeving,Beschermd stads- of dorpsgezicht,1995/12/05,5.572,51.155,Bocholt
Watermolen Clootsmolen: omgeving,Beschermd stads- of dorpsgezicht,1995/06/07,5.613,51.178,Bocholt
Pastorie Sint-Monulfus en Gondulfusparochie: tuin,Beschermd stads- of dorpsgezicht,2001/03/29,5.517,51.188,Bocholt
Sint-Luciakapel met omgeving,Beschermd cultuurhistorisch landschap,1976/10/15,5.139,51.168,Balen
Watermolen Straalmolen met omgeving,Beschermd stads- of dorpsgezicht,1997/12/23,5.126,51.143,Balen
Watermolen Hoolstmolen met omgeving,Beschermd stads- of dorpsgezicht,1987/01/12,5.153,51.150,Balen
Watermolen Topmolen: omgeving,Beschermd stads- of dorpsgezicht,1993/02/01,5.245,51.158,Balen
Pastorie Sint-Willibrordusparochie met poortgebouw en omgeving,Beschermd cultuurhistorisch landschap,1973/05/04,5.146,51.141,Balen
Windmolen Lemmensmolen met omgeving,Beschermd stads- of dorpsgezicht,1981/02/17,5.748,51.146,Kinrooi
Windmolen Keyersmolen met omgeving,Beschermd stads- of dorpsgezicht,1994/05/30,5.741,51.173,Kinrooi
Kasteel Borgitter met kasteelpark en omgeving,Beschermd stads- of dorpsgezicht,1981/01/13,5.804,51.161,Kinrooi
Hoeve Houbenhof: omgeving,Beschermd stads- of dorpsgezicht,2003/05/28,5.839,51.133,Kinrooi
Ommuurde tuin verdwenen pastorie Sint-Servatiusparochie,Beschermd stads- of dorpsgezicht,2005/10/20,5.805,51.126,Kinrooi
Stamproyerbroek,Beschermd cultuurhistorisch landschap,1985/02/08,5.688,51.180,Kinrooi
Vijverbroek,Beschermd cultuurhistorisch landschap,1993/03/11,5.824,51.160,Kinrooi
Dorpsdries Kleine Brogel en langgestrekte hoeve,Beschermd stads- of dorpsgezicht,2009/02/05,5.454,51.175,Peer
Langgestrekte hoeve en omgeving,Beschermd stads- of dorpsgezicht,2009/02/05,5.454,51.173,Peer
Vallei van de Dommel en Bollisserbeek,Beschermd cultuurhistorisch landschap,1987/12/29,5.429,51.154,Peer
Pastorie Sint-Ursulaparochie met tuin en kerkhof,Beschermd stads- of dorpsgezicht,1999/10/28,5.450,51.172,Peer
Hoeve Sannenhof: omgeving,Beschermd stads- of dorpsgezicht,2002/11/04,5.447,51.151,Peer
"Sigarenfabriek, directeurswoning, meesterwoning en omgeving",Beschermd stads- of dorpsgezicht,1994/09/01,5.405,51.130,Peer
Kapel Onze-Lieve-Vrouw-van-Rust en omgeving,Beschermd cultuurhistorisch landschap,1951/07/12,5.483,51.123,Peer
Parochiekerk Sint-Trudo met omgeving,Beschermd stads- of dorpsgezicht,1983/03/02,5.505,51.153,Peer
Afspanning en stadshoeve De Scherpe Steen en omgeving,Beschermd stads- of dorpsgezicht,1981/10/01,5.454,51.133,Peer
Watermolen Genaamolen met omgeving,Beschermd stads- of dorpsgezicht,1993/10/26,5.589,51.163,Bree
Watermolen Pollismolen met omgeving,Beschermd stads- of dorpsgezicht,1994/12/28,5.635,51.115,Bree
Parochiekerk Onze-Lieve-Vrouw met kerkhof,Beschermd stads- of dorpsgezicht,1981/09/08,5.588,51.148,Bree
Kerkhof parochiekerk Sint-Trudo en pastorietuin,Beschermd stads- of dorpsgezicht,1997/09/23,5.646,51.118,Bree
Watermolen Keyartmolen met omgeving,Beschermd stads- of dorpsgezicht,1993/11/18,5.657,51.123,Bree
Watermolen Galdermansmolen: omgeving,Beschermd stads- of dorpsgezicht,1996/03/19,5.662,51.126,Bree
Kapel van Onze-Lieve-Vrouw van Zeven Weeën: omgeving,Beschermd cultuurhistorisch landschap,1951/07/12,5.418,51.161,Hechtel-Eksel
Sint-Bernarduskapel van de Locht: omgeving,Beschermd stads- of dorpsgezicht,1999/12/16,5.366,51.141,Hechtel-Eksel
Kapel van Onze-Lieve-Vrouw van Lourdes: omgeving,Beschermd stads- of dorpsgezicht,2001/03/28,5.387,51.149,Hechtel-Eksel
Kapel van het Mussennest: omgeving,Beschermd stads- of dorpsgezicht,2001/03/28,5.406,51.145,Hechtel-Eksel
Malesbroek - Scherpenbergen,Beschermd cultuurhistorisch landschap,1985/11/29,5.034,51.142,Meerhout
Grote Hoeve en omgeving,Beschermd cultuurhistorisch landschap,1944/02/02,5.077,51.137,Meerhout
Parochiekerk Sint-Trudo: kerkhof,Beschermd cultuurhistorisch landschap,1976/06/11,5.079,51.131,Meerhout
Liefkenshoeve en omgeving,Beschermd stads- of dorpsgezicht,1978/06/16,5.065,51.119,Meerhout
Haanvense windmolen en omgeving,Beschermd stads- of dorpsgezicht,1981/05/20,5.053,51.117,Meerhout
"Parochiekerk Onze-Lieve-Vrouw, kerkhof en pastorie",Beschermd stads- of dorpsgezicht,2009/06/11,5.098,51.113,Meerhout
Burgerhuis De Zwarte Adelaar met tuin en omgeving van herenhuis Drossaart,Beschermd stads- of dorpsgezicht,1986/07/15,5.790,51.095,Maaseik
"Burgerhuizen, apotheek en stadshuis met omgeving",Beschermd stads- of dorpsgezicht,1986/07/25,5.792,51.095,Maaseik
Stadshoeve in Maasstijl met omgeving,Beschermd stads- of dorpsgezicht,1990/02/06,5.787,51.097,Maaseik
Burgerhuizen In den Prince van Luyck en De Stad Amsterdam,Beschermd stads- of dorpsgezicht,1985/11/25,5.791,51.095,Maaseik
Parochiekerk Sint-Lambertus: kerkhof,Beschermd stads- of dorpsgezicht,1998/02/13,5.705,51.088,Maaseik
Marktplein met dubbele rij lindebomen,Beschermd cultuurhistorisch landschap,1940/03/08,5.792,51.095,Maaseik
De Sloot,Beschermd cultuurhistorisch landschap,1974/03/18,5.798,51.081,Maaseik
Natuurgebied rond de Bosbeek,Beschermd cultuurhistorisch landschap,1985/03/28,5.735,51.092,Maaseik
Watermolen Kleeskensmolen met omgeving,Beschermd stads- of dorpsgezicht,1986/07/25,5.700,51.085,Maaseik
"Parochiekerk Sint-Dionysius, gedenktekens en burgerhuis met omgeving",Beschermd stads- of dorpsgezicht,1981/09/08,5.655,51.069,Maaseik
Watermolen Dorpermolen met omgeving,Beschermd stads- of dorpsgezicht,1981/09/08,5.654,51.068,Maaseik
Hoeve De Drie Marieën,Beschermd stads- of dorpsgezicht,1983/05/11,5.795,51.094,Maaseik
Stadscentrum Maaseik,Beschermd stads- of dorpsgezicht,1991/12/16,5.791,51.094,Maaseik
Watermolen Langerenmolen met omgeving,Beschermd stads- of dorpsgezicht,1987/01/21,5.718,51.087,Maaseik
Watermolen Neermolen met omgeving,Beschermd stads- of dorpsgezicht,1988/06/02,5.707,51.089,Maaseik
Watermolen Leverenmolen: molenaarswoning en omgeving,Beschermd stads- of dorpsgezicht,1993/10/20,5.682,51.081,Maaseik
Watermolen Volmolen met omgeving,Beschermd stads- of dorpsgezicht,1993/11/18,5.673,51.077,Maaseik
Molensite Wurfeldermolen,Beschermd stads- of dorpsgezicht,1993/12/16,5.758,51.093,Maaseik
Sint-Harlindis en Relindiskapel en Sint-Willibrordusput: omgeving,Beschermd stads- of dorpsgezicht,2000/12/08,5.805,51.101,Maaseik
Langgestrekte hoeve: landelijke omgeving met kasseiweg en wegkapel,Beschermd stads- of dorpsgezicht,2005/05/12,5.236,51.089,Beringen
Sint-Antoniuskapel van 1680,Beschermd stads- of dorpsgezicht,1993/07/06,5.248,51.089,Beringen
Kapel van Broekhoven,Beschermd cultuurhistorisch landschap,1976/08/10,5.227,51.044,Beringen
Watermolen Stalse Molen: omgeving,Beschermd stads- of dorpsgezicht,1994/12/28,5.246,51.064,Beringen
Parochiaal complex Sint-Theodardus: omgeving,Beschermd stads- of dorpsgezicht,1985/01/24,5.221,51.076,Beringen
Kolenhaven,Beschermd stads- of dorpsgezicht,1993/12/22,5.196,51.069,Beringen
Kioskplein en directeurswoning met omgevend park,Beschermd stads- of dorpsgezicht,1981/09/08,5.219,51.070,Beringen
Koerselse Heide en vallei van de Zwarte Beek,Beschermd cultuurhistorisch landschap,1987/03/30,5.312,51.088,Beringen
Pastorie Sint-Martinusparochie: omgeving,Beschermd stads- of dorpsgezicht,1996/07/08,5.373,51.029,Houthalen-Helchteren
Hoeve Claes en omgeving,Beschermd stads- of dorpsgezicht,1997/02/17,5.349,51.043,Houthalen-Helchteren
Kasteel Ter Dolen: omgeving,Beschermd cultuurhistorisch landschap,1982/06/30,5.391,51.065,Houthalen-Helchteren
Laambeekvallei,Erfgoedlandschap,2018/07/04,5.460,51.007,Houthalen-Helchteren
Windmolen De Hoop met omgeving,Beschermd stads- of dorpsgezicht,1978/02/21,5.767,51.072,Dilsen-Stokkem
Hoeve De Licht met omgeving,Beschermd stads- of dorpsgezicht,1979/10/16,5.716,51.040,Dilsen-Stokkem
Windmolen De Wachter met omgeving,Beschermd stads- of dorpsgezicht,1982/04/19,5.725,51.039,Dilsen-Stokkem
Gemeentehuis Rotem en onderwijzerswoning,Beschermd stads- of dorpsgezicht,1990/02/09,5.736,51.052,Dilsen-Stokkem
Dorpskern Elen,Beschermd stads- of dorpsgezicht,2004/02/12,5.759,51.066,Dilsen-Stokkem
Wijk Tivoli,Beschermd stads- of dorpsgezicht,2004/04/30,5.718,51.020,Dilsen-Stokkem
Afspanning en paardenstal,Beschermd stads- of dorpsgezicht,2004/04/30,5.720,51.020,Dilsen-Stokkem
Erfgoedlandschap Elerweerd,Erfgoedlandschap,2018/03/19,5.757,51.059,Dilsen-Stokkem
Oude dorpskern Dilsen,Beschermd stads- of dorpsgezicht,1992/12/14,5.736,51.033,Dilsen-Stokkem
Parochiekerk Sint-Lucia met kerkhof,Beschermd stads- of dorpsgezicht,1985/11/06,5.044,51.030,Tessenderlo
Windmolen Schaliënmolen met omgeving,Beschermd stads- of dorpsgezicht,1981/10/23,5.022,51.024,Tessenderlo
Kerkhoeve met tiendschuur en omgeving,Beschermd stads- of dorpsgezicht,1983/03/02,5.070,51.069,Tessenderlo
Galgenberg,Beschermd cultuurhistorisch landschap,1984/06/22,5.331,51.048,Heusden-Zolder
Domein van Terlamen en Bolderberg,Beschermd cultuurhistorisch landschap,1987/02/09,5.277,50.999,Heusden-Zolder
Parochiekerk Sint-Vincentius: kerkhof,Beschermd stads- of dorpsgezicht,1996/08/05,5.314,51.023,Heusden-Zolder
Witherenpastorie Woutershof met omgeving,Beschermd stads- of dorpsgezicht,1985/11/06,5.322,51.026,Heusden-Zolder
Domein van Obbeek: omgeving,Beschermd stads- of dorpsgezicht,2004/06/11,5.261,51.022,Heusden-Zolder
Sociale woonwijk Mariëndaalplaats,Beschermd stads- of dorpsgezicht,2003/12/04,5.055,50.982,Diest
Begijnhof: gebouwencomplex met omgeving,Beschermd cultuurhistorisch landschap,1939/02/20,5.061,50.987,Diest
Graanmarkt en Henri Verstappenplein,Beschermd stads- of dorpsgezicht,2003/12/04,5.055,50.984,Diest
Watermolen Ezeldijkmolen: omgeving,Beschermd stads- of dorpsgezicht,2003/12/04,5.057,50.989,Diest
Bogaardenklooster: site,Beschermd stads- of dorpsgezicht,2003/12/04,5.057,50.988,Diest
Grote Markt en omgeving,Beschermd stads- of dorpsgezicht,2003/12/04,5.051,50.985,Diest
Sint-Elisabethgasthuis met omgeving,Beschermd stads- of dorpsgezicht,1986/10/13,5.052,50.986,Diest
Erfgoedlandschap Citadel,Erfgoedlandschap,2015/11/20,5.044,50.983,Diest
Ensemble Demerstraat en Refugiestraat,Beschermd stads- of dorpsgezicht,2003/12/04,5.049,50.987,Diest
Pastorie Onze-Lieve-Vrouwparochie: tuin,Beschermd stads- of dorpsgezicht,2003/12/04,5.054,50.989,Diest
Kapel Sint-Anna en omgeving,Beschermd cultuurhistorisch landschap,1951/07/12,5.153,50.995,Lummen
Kapel Onze-Lieve-Vrouw van de Beukeboom en omgeving,Beschermd cultuurhistorisch landschap,1951/07/12,5.176,50.987,Lummen
Watermolen Kleine Molen en omgeving,Beschermd stads- of dorpsgezicht,1995/05/29,5.183,50.978,Lummen
Groeve Hermans,Beschermd cultuurhistorisch landschap,1994/05/05,5.597,51.008,As
"Sint-Aldegondiskerk met kerkhof, omheiningsmuur en grafkruisen",Beschermd cultuurhistorisch landschap,1948/05/31,5.586,51.009,As
Watermolen Oude Theunissenmolen met omgeving,Beschermd stads- of dorpsgezicht,1993/11/18,5.588,51.017,As
Watermolen 't Mieleke: omgeving,Beschermd stads- of dorpsgezicht,1995/05/29,5.581,51.010,As
Station As: omgeving,Beschermd stads- of dorpsgezicht,1996/03/19,5.601,51.005,As
Steenkoolterrils van Waterschei,Beschermd cultuurhistorisch landschap,1999/06/11,5.547,51.010,As
Vallei van de Dorpsbeek,Beschermd cultuurhistorisch landschap,1993/08/26,5.529,50.967,Genk
Watermolen Slagmolen met omgeving,Beschermd stads- of dorpsgezicht,1995/05/29,5.473,50.960,Genk
Natuurreservaat De Maten: fase 2 (uitgesloten vijvers),Beschermd cultuurhistorisch landschap,1976/01/21,5.447,50.950,Genk
Provinciaal Domein Bokrijk,Beschermd cultuurhistorisch landschap,1947/02/12,5.414,50.963,Genk
Natuurreservaat De Maten: fase 1,Beschermd cultuurhistorisch landschap,1975/08/21,5.452,50.950,Genk
Parochiekerk Sint-Monulfus en -Gondulfus: omgeving,Beschermd stads- of dorpsgezicht,2003/03/03,5.701,50.961,Maasmechelen
Pastorie Sint-Jorisparochie met omgeving,Beschermd stads- of dorpsgezicht,1980/07/18,5.719,50.941,Maasmechelen
Dorpskern Leut,Beschermd stads- of dorpsgezicht,1996/07/05,5.737,50.992,Maasmechelen
Kasteel Vilain XIIII met park,Beschermd cultuurhistorisch landschap,1991/04/24,5.748,50.994,Maasmechelen
Kasteel Vilain XIIII: kasteel en omliggend park,Beschermd cultuurhistorisch landschap,1953/08/13,5.743,50.995,Maasmechelen
"Pastorie Sint-Christoffelparochie, kerkhof en restanten kerk Sint-Christoffel",Beschermd stads- of dorpsgezicht,2001/12/21,5.683,50.939,Maasmechelen
Het Welleke,Beschermd cultuurhistorisch landschap,1981/06/12,5.388,50.983,Zonhoven
Vranckenschans met omgeving,Beschermd stads- of dorpsgezicht,1981/04/13,5.339,50.979,Zonhoven
De Holsteen,Beschermd cultuurhistorisch landschap,1967/09/11,5.427,50.995,Zonhoven
Kapel van de Heuven: kapelhof,Beschermd stads- of dorpsgezicht,1978/06/16,5.369,50.987,Zonhoven
Huis De Franse Kroon met omgeving,Beschermd stads- of dorpsgezicht,1987/04/21,5.368,50.995,Zonhoven
Slangebeekbronnen,Beschermd cultuurhistorisch landschap,1989/11/30,5.409,50.992,Zonhoven
Militair Domein de Molenheide,Beschermd cultuurhistorisch landschap,1995/02/23,5.429,50.991,Zonhoven
Kapel Onze-Lieve-Vrouw van Ten Eikenen met omgeving,Beschermd cultuurhistorisch landschap,1971/09/08,5.364,51.003,Zonhoven
Rotemse molen en omgeving,Beschermd stads- of dorpsgezicht,2005/05/30,5.093,50.929,Halen
Gesloten hoeve met omgeving,Beschermd stads- of dorpsgezicht,1986/06/12,5.124,50.926,Halen
Laathof en omgeving,Beschermd cultuurhistorisch landschap,1975/11/10,5.105,50.941,Halen
Hoeve en poortgebouw abdij Mariëndal met omgeving,Beschermd stads- of dorpsgezicht,1994/01/11,5.097,50.929,Halen
Boerenburgerhuis met tuin,Beschermd stads- of dorpsgezicht,1982/03/29,5.115,50.948,Halen
Kartuizerklooster Sint-Jansberg met omgeving,Beschermd stads- of dorpsgezicht,1978/03/01,5.093,50.971,Halen
"Het Geesthuys: woning, park, omwalling en weilanden",Beschermd stads- of dorpsgezicht,1994/10/12,5.084,50.983,Halen
Sterrebos,Beschermd cultuurhistorisch landschap,1993/07/09,5.259,50.922,Hasselt
Abdij van Herkenrode en omgeving,Beschermd cultuurhistorisch landschap,1974/12/05,5.285,50.955,Hasselt
Gesloten vakwerkhoeve: omgeving met wegkapel,Beschermd stads- of dorpsgezicht,2004/02/03,5.327,50.904,Hasselt
Gesloten hoeve: wijdere agrarische omgeving,Beschermd stads- of dorpsgezicht,2004/03/04,5.250,50.933,Hasselt
Langgestrekte vakwerkhoeve: omgeving,Beschermd stads- of dorpsgezicht,2009/06/15,5.298,50.942,Hasselt
Vakwerkhoeve met losse bestanddelen: omgeving met stal en bakhuis,Beschermd stads- of dorpsgezicht,2009/06/15,5.329,50.896,Hasselt
Vakwerkhoeve met losse bestanddelen: omgeving,Beschermd stads- of dorpsgezicht,2009/06/15,5.341,50.901,Hasselt
U-vormige vakwerkhoeve: omgeving,Beschermd stads- of dorpsgezicht,2009/06/15,5.259,50.913,Hasselt
U-vormige vakwerkhoeve Busselkenswinning: omgeving,Beschermd stads- of dorpsgezicht,2009/06/15,5.243,50.940,Hasselt
Vakwerkhoeve met losse bestanddelen en waterput: omgeving,Beschermd stads- of dorpsgezicht,2009/06/15,5.245,50.916,Hasselt
Gesloten hoeve In De Klok: omgeving,Beschermd stads- of dorpsgezicht,2009/06/15,5.354,50.884,Hasselt
Watermolen op de Herk met omgeving,Beschermd stads- of dorpsgezicht,1979/03/13,5.249,50.918,Hasselt
Kapel Onze-Lieve-Vrouw Troost der Kleine Kinderen met omgeving,Beschermd stads- of dorpsgezicht,1979/03/13,5.249,50.947,Hasselt
Het Beluikske met omgeving,Beschermd stads- of dorpsgezicht,1983/07/28,5.337,50.932,Hasselt
Parochiekerk Sint-Martinus met omgeving,Beschermd stads- of dorpsgezicht,1985/11/28,5.251,50.917,Hasselt
Semi-gesloten hoeve Spaans Huis met omgeving,Beschermd stads- of dorpsgezicht,1987/01/12,5.379,50.934,Hasselt
Woning De Drossaerd met omgeving,Beschermd stads- of dorpsgezicht,1993/10/26,5.305,50.944,Hasselt
Notariswoning Smeets: binnenhof en bijgebouwen,Beschermd stads- of dorpsgezicht,2002/10/21,5.343,50.931,Hasselt
Koninklijk Atheneum: omgeving,Beschermd stads- of dorpsgezicht,2002/10/22,5.342,50.929,Hasselt
Burgerhuis Heusden: tuin met bijgebouwen,Beschermd stads- of dorpsgezicht,2002/11/04,5.335,50.930,Hasselt
Burgerhuis De Engelkes: tuin,Beschermd stads- of dorpsgezicht,2002/11/04,5.340,50.928,Hasselt
Stadswoning De Gulden Put: binnenhof en bijgebouwen,Beschermd stads- of dorpsgezicht,2002/11/04,5.336,50.930,Hasselt
Neoclassicistisch herenhuis met dienstvleugels: omgeving,Beschermd stads- of dorpsgezicht,2002/11/04,5.332,50.932,Hasselt
Vakwerkhoeve met losse bestanddelen: omgeving,Beschermd stads- of dorpsgezicht,2005/02/14,5.300,50.903,Hasselt
Semi-gesloten vakwerkhoeve: omgeving,Beschermd stads- of dorpsgezicht,2008/06/25,5.331,50.900,Hasselt
Vakwerkhoeve: omgeving,Beschermd stads- of dorpsgezicht,2009/06/15,5.241,50.956,Hasselt
Vakwerkhoeve: omgeving,Beschermd stads- of dorpsgezicht,2009/06/15,5.303,50.943,Hasselt
Semi-gesloten vakwerkhoeve: omgeving,Beschermd stads- of dorpsgezicht,2009/06/15,5.349,50.884,Hasselt
Pastorie Onze-Lieve-Vrouwparochie met omgeving,Beschermd cultuurhistorisch landschap,1943/12/20,5.570,50.931,Zutendaal
Watermolen Suetendaelmolen met omgeving,Beschermd stads- of dorpsgezicht,1995/05/29,5.545,50.916,Zutendaal
Vakwerkhoeve: omgeving,Beschermd stads- of dorpsgezicht,2002/02/28,5.218,50.955,Herk-de-Stad
Hoeve Amandinahuis: omgeving,Beschermd stads- of dorpsgezicht,2002/05/23,5.204,50.906,Herk-de-Stad
Oude boomkwekerij De Pierpont,Beschermd cultuurhistorisch landschap,1987/03/23,5.169,50.935,Herk-de-Stad
Vakwerkhoeve: omgeving,Beschermd stads- of dorpsgezicht,2005/02/01,5.160,50.935,Herk-de-Stad
Langgestrekte vakwerkhoeve: omgeving,Beschermd stads- of dorpsgezicht,2008/12/24,5.218,50.950,Herk-de-Stad
Watermolen Nieuwe Molen: omgeving,Beschermd stads- of dorpsgezicht,2008/12/24,5.203,50.931,Herk-de-Stad
Langgestrekte vakwerkhoeve: omgeving,Beschermd stads- of dorpsgezicht,2008/12/24,5.215,50.959,Herk-de-Stad
Vakwerkhoeve met losse bestanddelen: omgeving,Beschermd stads- of dorpsgezicht,2008/12/24,5.146,50.937,Herk-de-Stad
Vierkantshoeve: stenen componenten met erf,Beschermd stads- of dorpsgezicht,2008/12/24,5.201,50.907,Herk-de-Stad
Langgestrekte vakwerkhoeve: omgeving,Beschermd stads- of dorpsgezicht,2008/12/24,5.185,50.923,Herk-de-Stad
Langgestrekte vakwerkhoeve met waterput: omgeving,Beschermd stads- of dorpsgezicht,2008/12/24,5.182,50.931,Herk-de-Stad
Vakwerkhoeve met waterput: omgeving,Beschermd stads- of dorpsgezicht,2008/12/24,5.214,50.915,Herk-de-Stad
Langgestrekte vakwerkhoeve: omgeving,Beschermd stads- of dorpsgezicht,2008/12/24,5.188,50.900,Herk-de-Stad
Vakwerkhoeve met losse bestanddelen: omgeving,Beschermd stads- of dorpsgezicht,2008/12/24,5.194,50.905,Herk-de-Stad
Vakwerkhoeve met losse bestanddelen: omgeving,Beschermd stads- of dorpsgezicht,2008/12/24,5.223,50.921,Herk-de-Stad
Vakwerkhoeve met losse bestanddelen: omgeving,Beschermd stads- of dorpsgezicht,2008/12/24,5.221,50.910,Herk-de-Stad
Hoeve Bouquetwinning met omgeving,Beschermd stads- of dorpsgezicht,1981/09/08,5.393,50.903,Diepenbeek
Watermolen Rooiermolen met omgeving,Beschermd stads- of dorpsgezicht,1983/02/03,5.399,50.929,Diepenbeek
Kasteel van Diepenbeek: kasteeldomein,Beschermd stads- of dorpsgezicht,2002/06/25,5.420,50.912,Diepenbeek
Watermolen Sapittelmolen met omgeving,Beschermd stads- of dorpsgezicht,1983/02/03,5.434,50.908,Diepenbeek
Langgestrekte vakwerkhoeve: omgeving,Beschermd stads- of dorpsgezicht,2009/06/15,5.443,50.903,Diepenbeek
Langgestrekte vakwerkhoeve Den Vrouwenhof: omgeving,Beschermd stads- of dorpsgezicht,2009/06/15,5.398,50.904,Diepenbeek
Vakwerkhoeve met losse bestanddelen Voswinning: omgeving,Beschermd stads- of dorpsgezicht,2009/06/15,5.423,50.891,Diepenbeek
Langgestrekte vakwerkhoeve: omgeving,Beschermd stads- of dorpsgezicht,2009/06/15,5.409,50.910,Diepenbeek
Langgestrekte vakwerkhoeve: omgeving,Beschermd stads- of dorpsgezicht,2009/06/15,5.443,50.898,Diepenbeek
Vakwerkhoeve met losse bestanddelen: aanhorigheden en omgeving,Beschermd stads- of dorpsgezicht,2009/06/15,5.380,50.889,Diepenbeek
Vakwerkhoeve met losse bestanddelen: omgeving,Beschermd stads- of dorpsgezicht,2009/06/15,5.455,50.912,Diepenbeek
Vakwerkhoeve met losse bestanddelen Merlemont: omgeving,Beschermd stads- of dorpsgezicht,2009/06/15,5.406,50.883,Diepenbeek
Semi-gesloten hoevecomplex Groot Terherken: hoevecomponenten en omgeving,Beschermd stads- of dorpsgezicht,2009/06/15,5.387,50.884,Diepenbeek
U-vormige vakwerkhoeve: omgeving,Beschermd stads- of dorpsgezicht,2009/06/15,5.430,50.918,Diepenbeek
Vakwerkhoeve: omgeving,Beschermd stads- of dorpsgezicht,2009/06/15,5.370,50.898,Diepenbeek
Kasteel Pietersheim: domein,Beschermd cultuurhistorisch landschap,1983/05/11,5.667,50.900,Lanaken
Parochiekerk Sint-Lambertus: kerkhof,Beschermd stads- of dorpsgezicht,1999/10/28,5.688,50.907,Lanaken
L-Vormige hoeve van 1818 met omgeving,Beschermd stads- of dorpsgezicht,2001/04/27,5.686,50.906,Lanaken
L-vormige hoeve van 1865 met omgeving,Beschermd stads- of dorpsgezicht,2001/04/27,5.686,50.918,Lanaken
"Gesloten hoeve: overige hoevegebouwen, lindeboom en omgeving",Beschermd stads- of dorpsgezicht,2002/05/23,5.669,50.896,Lanaken
Watermolen Heidemolen met omgeving,Beschermd stads- of dorpsgezicht,2005/06/21,5.649,50.901,Lanaken
"Kasteel van Hocht: neerhof, park, dreven en omliggende weilanden en boomgaarden",Beschermd cultuurhistorisch landschap,1976/11/29,5.685,50.898,Lanaken
Kapel Slag van Lafelt met omgeving,Beschermd cultuurhistorisch landschap,1975/04/17,5.615,50.861,Lanaken
Boerenwoning De Hoek met omgeving,Beschermd stads- of dorpsgezicht,1981/01/29,5.703,50.923,Lanaken
Kapel Sint-Petronella met omgeving,Beschermd stads- of dorpsgezicht,1981/10/23,5.685,50.915,Lanaken
Oude kern Rekem,Beschermd stads- of dorpsgezicht,1994/09/28,5.704,50.924,Lanaken
Motte In de Burg met omgeving,Beschermd stads- of dorpsgezicht,1978/03/01,5.610,50.881,Lanaken
Gehucht Smeermaas met aansluitend gedeelte Zuid-Willemsvaart,Beschermd stads- of dorpsgezicht,2002/11/04,5.676,50.884,Lanaken
Kasteel Hogemeyer: landgoed,Beschermd stads- of dorpsgezicht,2001/02/23,4.994,50.896,Kortenaken
Kerkhof en pastorietuin,Beschermd stads- of dorpsgezicht,2001/02/23,4.994,50.887,Kortenaken
Dorpskern Miskom,Beschermd stads- of dorpsgezicht,2001/11/22,5.012,50.895,Kortenaken
Molenbemden,Beschermd cultuurhistorisch landschap,1991/04/24,5.526,50.823,Bilzen
Groenendaal-Zangerhei,Beschermd cultuurhistorisch landschap,2001/06/29,5.555,50.886,Bilzen
Kasteel van Schoonbeek met dreef en park,Beschermd cultuurhistorisch landschap,1958/03/05,5.476,50.898,Bilzen
